{
  "@context": [
    "https://schema.org",
    "https://www.w3.org/ns/dcat"
  ],
  "@type": "Dataset",
  "name": "Anac Feed",
  "description": "Feed com notícias, vídeos e legislações (atos normativos) coletados das publicações da Agência Nacional de Aviação Civil (Anac)",
  "identifier": "urn:uuid:anac-feed-8a11f9a8-3603-4b8e-9f35-d7b66f75045c",
  "url": "https://www.gov.br/anac/pt-br/noticias",
  "license": "https://creativecommons.org/licenses/by/4.0/",
  "dateCreated": "2025-10-24T04:17:07.312Z",
  "dateModified": "2025-10-24T04:17:07.312Z",
  "publisher": {
    "@type": "Organization",
    "name": "Agência Nacional de Aviação Civil (Anac)",
    "url": "https://www.gov.br/anac"
  },
  "creator": {
    "@type": "Organization",
    "name": "Assessoria de Comunicação Social (ASCOM) - Anac",
    "url": "https://www.gov.br/anac"
  },
  "temporalCoverage": {
    "startDate": "2025-08-22T09:15:57.000Z",
    "endDate": "2025-10-23T15:56:07.000Z"
  },
  "distribution": [
    {
      "@type": "DataDownload",
      "encodingFormat": "application/json",
      "contentUrl": "./feed.json"
    }
  ],
  "items": [
    {
      "@type": "VideoObject",
      "name": "SMS Brazil: Há 10 anos contribuindo com a segurança operacional da aviação civil.",
      "url": "https://www.youtube.com/watch?v=PGYrnRdnq30",
      "datePublished": "2025-10-23T15:56:07.000Z",
      "description": "Realizado pela Agência Nacional de Aviação Civil (Anac), a 10ª edição do Safety Management Summit Brazil (SMS Brasil) consolida-se como o principal fórum nacional dedicado à segurança operacional da aviação civil brasileira.",
      "image": "https://i1.ytimg.com/vi/PGYrnRdnq30/hqdefault.jpg",
      "type": "vídeo"
    },
    {
      "@type": "Legislation",
      "name": "PORTARIA Nº 18100/SPL, 21/10/2025",
      "url": "https://www.anac.gov.br/assuntos/legislacao/legislacao-1/portarias/2025/portaria-18100",
      "datePublished": "2025-10-21T00:00:00.000Z",
      "description": "Torna pública a emissão do Certificado de Centro de Instrução de Aviação Civil em favor do Centro de Instrução AVSEC HTC TREINAMENTOS E NEGOCIOS EMPRESARIAIS LTDA.",
      "type": "legislação"
    },
    {
      "@type": "Legislation",
      "name": "PORTARIA Nº 18096/SPL, 21/10/2025",
      "url": "https://www.anac.gov.br/assuntos/legislacao/legislacao-1/portarias/2025/portaria-18096",
      "datePublished": "2025-10-21T00:00:00.000Z",
      "description": "Credenciamento de médico em conformidade com o Regulamento Brasileiro da Aviação Civil - RBAC nº 67",
      "type": "legislação"
    },
    {
      "@type": "Legislation",
      "name": "PORTARIA Nº 18091/SIA, 20/10/2025",
      "url": "https://www.anac.gov.br/assuntos/legislacao/legislacao-1/portarias/2025/portaria-18091",
      "datePublished": "2025-10-20T00:00:00.000Z",
      "description": "Aprova o Plano Diretor do Aeródromo Oscar Laranjeiras / Caruaru  (PE), SNRU - CIAD:PE0004",
      "type": "legislação"
    },
    {
      "@type": "VideoObject",
      "name": "Webinário IS 65-001F - Concessão de Licença e Habilitações para MMA",
      "url": "https://www.youtube.com/watch?v=zgHAnR8oBsY",
      "datePublished": "2025-10-17T08:34:42.000Z",
      "description": "A SPL acaba de revisar a IS 65-001 com modificações significativas ao procedimento de exame prático para mecânico de manutenção aeronáutica (MMA) e contagem da experiência prática. É necessário explicar ao público interessado tais mudanças. \n\nO objetivo é explicar os novos procedimentos para concessão de licença e habilitações para MMA.\n\nLink do slido: https://app.sli.do/event/e19sudAMXLa4CWaC5qJnVF",
      "image": "https://i3.ytimg.com/vi/zgHAnR8oBsY/hqdefault.jpg",
      "type": "vídeo"
    },
    {
      "@type": "Legislation",
      "name": "PORTARIA Nº 18079/SIA, 17/10/2025",
      "url": "https://www.anac.gov.br/assuntos/legislacao/legislacao-1/portarias/2025/portaria-18079",
      "datePublished": "2025-10-17T00:00:00.000Z",
      "description": "Inscreve o Aeródromo de uso privativo CIAD TO0051 no cadastro de aeródromos",
      "type": "legislação"
    },
    {
      "@type": "Legislation",
      "name": "PORTARIA Nº 18083/SIA, 17/10/2025",
      "url": "https://www.anac.gov.br/assuntos/legislacao/legislacao-1/portarias/2025/portaria-18083",
      "datePublished": "2025-10-17T00:00:00.000Z",
      "description": "Altera a inscrição do Aeródromo de uso privativo CIAD MS0278 no cadastro de aeródromos",
      "type": "legislação"
    },
    {
      "@type": "Legislation",
      "name": "PORTARIA Nº 18077/SIA, 16/10/2025",
      "url": "https://www.anac.gov.br/assuntos/legislacao/legislacao-1/portarias/2025/portaria-18077",
      "datePublished": "2025-10-16T00:00:00.000Z",
      "description": "Altera a inscrição do Aeródromo de uso privativo CIAD PI0046 no cadastro de aeródromos",
      "type": "legislação"
    },
    {
      "@type": "Legislation",
      "name": "PORTARIA Nº 18074/SIA, 16/10/2025",
      "url": "https://www.anac.gov.br/assuntos/legislacao/legislacao-1/portarias/2025/portaria-18074",
      "datePublished": "2025-10-16T00:00:00.000Z",
      "description": "Inscreve o Aeródromo de uso privativo CIAD MG0658 no cadastro de aeródromos",
      "type": "legislação"
    },
    {
      "@type": "Legislation",
      "name": "DECISÃO Nº 724, 16/10/2025",
      "url": "https://www.anac.gov.br/assuntos/legislacao/legislacao-1/decisoes/2025/decisao-724",
      "datePublished": "2025-10-16T00:00:00.000Z",
      "description": "Defere parcialmente pedido de isenção de cumprimento dos requisitos de que tratam os parágrafos 154.207(d) e (f) do RBAC nº 154, no Aeroporto Internacional Guararapes / Gilberto Freyre, localizado em Recife (PE)",
      "type": "legislação"
    },
    {
      "@type": "Legislation",
      "name": "DECISÃO Nº 725, 16/10/2025",
      "url": "https://www.anac.gov.br/assuntos/legislacao/legislacao-1/decisoes/2025/decisao-725",
      "datePublished": "2025-10-16T00:00:00.000Z",
      "description": "Altera a Decisão nº 532, de 3 de junho de 2022, a Decisão nº 626, de 2 de agosto de 2023, e a Decisão nº 693, de 5 de dezembro de 2024",
      "type": "legislação"
    },
    {
      "@type": "Legislation",
      "name": "RESOLUÇÃO Nº 781, 16/10/2025",
      "url": "https://www.anac.gov.br/assuntos/legislacao/legislacao-1/resolucoes/2025/resolucao-781",
      "datePublished": "2025-10-16T00:00:00.000Z",
      "description": "Altera a Resolução nº 708, de 30 de março de 2023",
      "type": "legislação"
    },
    {
      "@type": "Legislation",
      "name": "RESOLUÇÃO Nº 780, 16/10/2025",
      "url": "https://www.anac.gov.br/assuntos/legislacao/legislacao-1/resolucoes/2025/resolucao-780",
      "datePublished": "2025-10-16T00:00:00.000Z",
      "description": "Regulamenta o registro e a divulgação dos dados de tarifas aéreas comercializadas referentes aos serviços de transporte aéreo de passageiros, e altera a Resolução nº 762, de 18 de dezembro de 2024",
      "type": "legislação"
    },
    {
      "@type": "Legislation",
      "name": "PORTARIA Nº 18075/SIA, 16/10/2025",
      "url": "https://www.anac.gov.br/assuntos/legislacao/legislacao-1/portarias/2025/portaria-18075",
      "datePublished": "2025-10-16T00:00:00.000Z",
      "description": "Aprova o Plano Diretor do Aeroporto Orlando Bezerra de Menezes / Juazeiro do Norte (CE), SBJU - CIAD: CE0002",
      "type": "legislação"
    },
    {
      "@type": "Legislation",
      "name": "PORTARIA Nº 18073/SIA, 16/10/2025",
      "url": "https://www.anac.gov.br/assuntos/legislacao/legislacao-1/portarias/2025/portaria-18073",
      "datePublished": "2025-10-16T00:00:00.000Z",
      "description": "Aprova a Diretriz de Segurança da Aviação Civil contra Atos de Interferência Ilícita nº 04-2021, Revisão C",
      "type": "legislação"
    },
    {
      "@type": "Legislation",
      "name": "PORTARIA Nº 18076/SIA, 16/10/2025",
      "url": "https://www.anac.gov.br/assuntos/legislacao/legislacao-1/portarias/2025/portaria-18076",
      "datePublished": "2025-10-16T00:00:00.000Z",
      "description": "Altera a Portaria nº 3.214/SIA, de 10 de novembro de 2020",
      "type": "legislação"
    },
    {
      "@type": "Legislation",
      "name": "RESOLUÇÃO Nº 781, 16/10/2025",
      "url": "https://www.anac.gov.br/assuntos/legislacao/legislacao-1/resolucoes/2025/resolucao-781",
      "datePublished": "2025-10-16T00:00:00.000Z",
      "description": "Altera a Resolução nº 708, de 30 de março de 2023",
      "type": "legislação"
    },
    {
      "@type": "Legislation",
      "name": "DECISÃO Nº 724, 16/10/2025",
      "url": "https://www.anac.gov.br/assuntos/legislacao/legislacao-1/decisoes/2025/decisao-724",
      "datePublished": "2025-10-16T00:00:00.000Z",
      "description": "Defere parcialmente pedido de isenção de cumprimento dos requisitos de que tratam os parágrafos 154.207(d) e (f) do RBAC nº 154, no Aeroporto Internacional Guararapes / Gilberto Freyre, localizado em Recife (PE)",
      "type": "legislação"
    },
    {
      "@type": "Legislation",
      "name": "DECISÃO Nº 725, 16/10/2025",
      "url": "https://www.anac.gov.br/assuntos/legislacao/legislacao-1/decisoes/2025/decisao-725",
      "datePublished": "2025-10-16T00:00:00.000Z",
      "description": "Altera a Decisão nº 532, de 3 de junho de 2022, a Decisão nº 626, de 2 de agosto de 2023, e a Decisão nº 693, de 5 de dezembro de 2024",
      "type": "legislação"
    },
    {
      "@type": "Legislation",
      "name": "RESOLUÇÃO Nº 780, 16/10/2025",
      "url": "https://www.anac.gov.br/assuntos/legislacao/legislacao-1/resolucoes/2025/resolucao-780",
      "datePublished": "2025-10-16T00:00:00.000Z",
      "description": "Regulamenta o registro e a divulgação dos dados de tarifas aéreas comercializadas referentes aos serviços de transporte aéreo de passageiros, e altera a Resolução nº 762, de 18 de dezembro de 2024",
      "type": "legislação"
    },
    {
      "@type": "VideoObject",
      "name": "Audiência Pública Virtual da Consulta Pública nº 11/2025",
      "url": "https://www.youtube.com/watch?v=6X1GXm4fgaM",
      "datePublished": "2025-10-15T07:00:50.000Z",
      "description": "Audiência Pública da Consulta Pública nº 11/2025 - Proposta de Edital de Venda Assistida - Contrato de Concessão nº 001/ANAC/2014 - Aeroporto Internacional do Rio de Janeiro (Galeão)\n \nDescrição:\nA Consulta Pública nº 11/2025 propõe o processo de Venda Assistida do Contrato de Concessão nº 001/ANAC/2014-SBGL, relativas à concessão para ampliação, manutenção e exploração do Aeroporto Internacional do Rio de Janeiro - Galeão. \n\nAcesse os documentos da Consulta Pública e faça a sua contribuição nos formulários eletrônicos disponíveis no endereço: https://www.gov.br/participamaisbrasil/cp-11-2025",
      "image": "https://i3.ytimg.com/vi/6X1GXm4fgaM/hqdefault.jpg",
      "type": "vídeo"
    },
    {
      "@type": "Legislation",
      "name": "PORTARIA Nº 18065/SIA, 15/10/2025",
      "url": "https://www.anac.gov.br/assuntos/legislacao/legislacao-1/portarias/2025/portaria-18065",
      "datePublished": "2025-10-15T00:00:00.000Z",
      "description": "Inscreve o Aeródromo de uso privativo CIAD PA0440 no cadastro de aeródromos",
      "type": "legislação"
    },
    {
      "@type": "Legislation",
      "name": "PORTARIA Nº 18059/SIA, 14/10/2025",
      "url": "https://www.anac.gov.br/assuntos/legislacao/legislacao-1/portarias/2025/portaria-18059",
      "datePublished": "2025-10-14T00:00:00.000Z",
      "description": "Inscreve o Aeródromo de uso privativo CIAD GO0416 no cadastro de aeródromos",
      "type": "legislação"
    },
    {
      "@type": "Legislation",
      "name": "PORTARIA Nº 18060/SIA, 14/10/2025",
      "url": "https://www.anac.gov.br/assuntos/legislacao/legislacao-1/portarias/2025/portaria-18060",
      "datePublished": "2025-10-14T00:00:00.000Z",
      "description": "Inscreve o Aeródromo de uso privativo CIAD MT0480 no cadastro de aeródromos",
      "type": "legislação"
    },
    {
      "@type": "VideoObject",
      "name": "Embraer Ipanema: boas práticas de segurança",
      "url": "https://www.youtube.com/watch?v=oIgGzr1zey8",
      "datePublished": "2025-10-13T19:18:56.000Z",
      "description": "Link Slido: https://app.sli.do/event/uJdihManRuctcUxhaZV3Wv",
      "image": "https://i4.ytimg.com/vi/oIgGzr1zey8/hqdefault.jpg",
      "type": "vídeo"
    },
    {
      "@type": "VideoObject",
      "name": "Já se perguntou como o avião consegue voar?",
      "url": "https://www.youtube.com/watch?v=_-5lBoZoZCU",
      "datePublished": "2025-10-13T13:46:41.000Z",
      "description": "Neste Dia das Crianças, embarque com a gente nessa aventura divertida sobre as forças que fazem a magia acontecer nos céus! \n\nPorque aprender pode ser tão divertido quanto brincar! 💙\n\nFeliz Dia das Crianças! 🎉\n\nLetra:\nComo o avião voa?\n\nOlha o avião lá no céu a planar,\nMas como será que ele consegue voar?\nAs asas têm formato especial, você vai ver,\nFazendo o ar se mover pra cima crescer.\n\nPor cima o ar corre mais depressa, é tensão,\nPor baixo ele vai lento, isso dá sustentação.\nÉ a física que cria essa força no ar,\nChamamos de sustentação pra ele levantar!\n\nVoa, voa avião, no céu a planar,\nCom motor e asa, pronto pra voar!\nEmpurrando lá na frente, turbinas a girar,\nÉ propulsão que ajuda ele a avançar!\n\nMas não é só isso que faz o avião flutuar,\nO piloto também precisa o voo controlar.\nUsa leme, profundor e aileron pra guiar,\nMudando direção pra rota manter no ar.\n\nCom motor, asas e ciência no coração,\nO avião corta o céu numa perfeita canção.\nÉ física, engenharia e um sonho no ar,\nJuntos fazendo o avião poder voar!\n\nVoa, voa avião, sobe lá no ar,\nLevando gente e sonhos pra viajar.\nDecola bonito, com ciência a soprar,\nAgora você sabe como o avião pode voar!\n\n*Vídeo e música produzida com inteligência artificial.",
      "image": "https://i4.ytimg.com/vi/_-5lBoZoZCU/hqdefault.jpg",
      "type": "vídeo"
    },
    {
      "@type": "Legislation",
      "name": "PORTARIA Nº 18049/SPO, 13/10/2025",
      "url": "https://www.anac.gov.br/assuntos/legislacao/legislacao-1/portarias/2025/portaria-18049",
      "datePublished": "2025-10-13T00:00:00.000Z",
      "description": "Aprova o Manual de Procedimento - MPR/SPO-130-R00",
      "type": "legislação"
    },
    {
      "@type": "Legislation",
      "name": "DECISÃO Nº 723, 09/10/2025",
      "url": "https://www.anac.gov.br/assuntos/legislacao/legislacao-1/decisoes/2025/decisao-723",
      "datePublished": "2025-10-09T00:00:00.000Z",
      "description": "Autoriza a exploração do aeródromo civil público denominado \"Aeródromo de Itapera\"",
      "type": "legislação"
    },
    {
      "@type": "Legislation",
      "name": "PORTARIA Nº 18024/SIA, 08/10/2025",
      "url": "https://www.anac.gov.br/assuntos/legislacao/legislacao-1/portarias/2025/portaria-18024",
      "datePublished": "2025-10-08T00:00:00.000Z",
      "description": "Inscreve o Heliponto de uso privativo ao nível do solo CIAD RJ0400 no cadastro de aeródromos",
      "type": "legislação"
    },
    {
      "@type": "Legislation",
      "name": "PORTARIA Nº 18027/SIA, 08/10/2025",
      "url": "https://www.anac.gov.br/assuntos/legislacao/legislacao-1/portarias/2025/portaria-18027",
      "datePublished": "2025-10-08T00:00:00.000Z",
      "description": "Inscreve o Aeródromo de uso privativo CIAD PA0439 no cadastro de aeródromos",
      "type": "legislação"
    },
    {
      "@type": "Legislation",
      "name": "IS 183-003C",
      "url": "https://www.anac.gov.br/assuntos/legislacao/legislacao-1/iac-e-is/is/is-183-003",
      "datePublished": "2025-10-01T19:04:00.000Z",
      "description": "Processo de credenciamento de profissional qualificado para aplicação do exame de proficiência em Mecânicos de Manutenção Aeronáutica",
      "type": "legislação"
    },
    {
      "@type": "Legislation",
      "name": "IS 65-001F",
      "url": "https://www.anac.gov.br/assuntos/legislacao/legislacao-1/iac-e-is/is/is-65-001",
      "datePublished": "2025-10-01T18:32:00.000Z",
      "description": "Procedimentos para concessão de licença e de habilitação e para recadastramento de mecânicos de manutenção aeronáutica",
      "type": "legislação"
    },
    {
      "@type": "Legislation",
      "name": "IS 141-001E",
      "url": "https://www.anac.gov.br/assuntos/legislacao/legislacao-1/iac-e-is/is/is-141-001",
      "datePublished": "2025-10-01T17:35:00.000Z",
      "description": "Procedimentos para a comunicação da relação de alunos matriculados e instrutores pelos Centros de Instrução de Aviação Civil - Ciacs",
      "type": "legislação"
    },
    {
      "@type": "VideoObject",
      "name": "Programa Asas para Todos",
      "url": "https://www.youtube.com/watch?v=eeWySesFFAk",
      "datePublished": "2025-10-01T12:13:39.000Z",
      "description": "A aviação é feita de tecnologia, inovação e, acima de tudo, pessoas. \n\nCom o programa Asas para Todos, a Agência Nacional de Aviação Civil (Anac) abre caminhos para que mais pessoas realizem seus sonhos no setor aéreo — da infância à formação profissional. \n\nConheça mais sobre o programa que inspira e abre oportunidades para as carreiras da aviação: https://hotsites.anac.gov.br/asasparatodos/",
      "image": "https://i2.ytimg.com/vi/eeWySesFFAk/hqdefault.jpg",
      "type": "vídeo"
    },
    {
      "@type": "VideoObject",
      "name": "Semana de Cibersegurança da ANAC 2025",
      "url": "https://www.youtube.com/watch?v=59Nj2ERVgWE",
      "datePublished": "2025-09-30T03:23:38.000Z",
      "description": "Dúvidas e perguntas: https://app.sli.do/event/6fTo3z3SUUhpjU3jS71RX2",
      "image": "https://i2.ytimg.com/vi/59Nj2ERVgWE/hqdefault.jpg",
      "type": "vídeo"
    },
    {
      "@type": "Legislation",
      "name": "IS 121-011D",
      "url": "https://www.anac.gov.br/assuntos/legislacao/legislacao-1/iac-e-is/is/is-121-011",
      "datePublished": "2025-09-23T17:06:00.000Z",
      "description": "Procedimentos para elaboração de programa de treinamento operacional de comissários de voo segundo o RBAC nº 121",
      "type": "legislação"
    },
    {
      "@type": "Legislation",
      "name": "IS 91-003B",
      "url": "https://www.anac.gov.br/assuntos/legislacao/legislacao-1/iac-e-is/is/is-91-003b",
      "datePublished": "2025-09-23T15:38:00.000Z",
      "description": "Aprovação operacional para aproximações ILS CAT I com autorização requerida e decolagens com baixa visibilidade mediante o emprego do Head Up Guidance System (HGS)",
      "type": "legislação"
    },
    {
      "@type": "Legislation",
      "name": "IS 121-002B",
      "url": "https://www.anac.gov.br/assuntos/legislacao/legislacao-1/iac-e-is/is/is-121-002b",
      "datePublished": "2025-09-23T15:36:00.000Z",
      "description": "Examinadores credenciados no âmbito dos operadores aéreos regidos pelo RBAC nº 121",
      "type": "legislação"
    },
    {
      "@type": "Legislation",
      "name": "IS 91-010D",
      "url": "https://www.anac.gov.br/assuntos/legislacao/legislacao-1/iac-e-is/is/is-91-010",
      "datePublished": "2025-09-23T14:47:00.000Z",
      "description": "Procedimentos para autorização do uso de comunicação por enlace de dados controlador-piloto (CPDLC) e de vigilância dependente automática-contrato (ADS-C)",
      "type": "legislação"
    },
    {
      "@type": "Legislation",
      "name": "RBAC 153 EMD 09",
      "url": "https://www.anac.gov.br/assuntos/legislacao/legislacao-1/rbha-e-rbac/rbac/rbac-153",
      "datePublished": "2025-09-23T10:16:00.000Z",
      "description": "Aeródromos - Operação, Manutenção e Resposta à Emergência",
      "type": "legislação"
    },
    {
      "@type": "Legislation",
      "name": "IS 91-011C",
      "url": "https://www.anac.gov.br/assuntos/legislacao/legislacao-1/iac-e-is/is/is-91-011",
      "datePublished": "2025-09-22T15:22:00.000Z",
      "description": "Aprovação de aproximação por instrumento utilizando créditos operacionais mediante o uso de um EFVS - Enhanced Flight Vision System",
      "type": "legislação"
    },
    {
      "@type": "Legislation",
      "name": "IS 121-006E",
      "url": "https://www.anac.gov.br/assuntos/legislacao/legislacao-1/iac-e-is/is/is-121-006",
      "datePublished": "2025-09-22T14:09:00.000Z",
      "description": "Procedimentos gerais para elaboração, aprovação, revisão e utilização de programas de treinamento operacional (PTO) de operadores aéreos regidos pelo RBAC nº 121",
      "type": "legislação"
    },
    {
      "@type": "Legislation",
      "name": "INSTRUÇÃO NORMATIVA Nº 216, 22/09/2025",
      "url": "https://www.anac.gov.br/assuntos/legislacao/legislacao-1/instrucoes-normativas/2025/instrucao-normativa-216",
      "datePublished": "2025-09-22T00:00:00.000Z",
      "description": "Altera a Instrução Normativa nº 155, de 14 de maio de 2020",
      "type": "legislação"
    },
    {
      "@type": "VideoObject",
      "name": "Webinário &quot;Acordos Bilaterais EASA, UK, CAA e FAA para Organizações de Manutenção&quot;",
      "url": "https://www.youtube.com/watch?v=hlRq2eZOm18",
      "datePublished": "2025-09-19T14:45:05.000Z",
      "description": "A ANAC firmou acordos de manutenção aeronáutica com as principais autoridades estrangeiras (EASA, UK, CAA e FAA) para convalidação de certificados, possibilitando que organizações de manutenção brasileiras possam realizar manutenção em aeronaves desses países. Para tanto, é necessário que a OM convalide seu certificado com a outra autoridade. O evento apresenta os requisitos e processo para convalidação de certificados de OM com autoridades estrangeiras.\n\nLink Slido: https://app.sli.do/event/o7T9gqeVfFuQ26efqcNjLr",
      "image": "https://i1.ytimg.com/vi/hlRq2eZOm18/hqdefault.jpg",
      "type": "vídeo"
    },
    {
      "@type": "VideoObject",
      "name": "12ª Reunião Deliberativa da Diretoria Colegiada (17/09/2025)",
      "url": "https://www.youtube.com/watch?v=FBySE3Veewg",
      "datePublished": "2025-09-18T00:39:56.000Z",
      "description": "Início - 10:43\n1) Processo 00058.078972/2025-19 - 25:09\n2) Processo 00058.070806/2024-85 - 38:09",
      "image": "https://i3.ytimg.com/vi/FBySE3Veewg/hqdefault.jpg",
      "type": "vídeo"
    },
    {
      "@type": "Legislation",
      "name": "RESOLUÇÃO Nº 779, 18/09/2025",
      "url": "https://www.anac.gov.br/assuntos/legislacao/legislacao-1/resolucoes/2025/resolucao-779",
      "datePublished": "2025-09-18T00:00:00.000Z",
      "description": "Aprova a Emenda nº 09 ao RBAC nº 153",
      "type": "legislação"
    },
    {
      "@type": "VideoObject",
      "name": "Cerimônia de posse da nova diretoria da Anac",
      "url": "https://www.youtube.com/watch?v=jTD_JdU6otI",
      "datePublished": "2025-09-17T14:51:48.000Z",
      "description": "",
      "image": "https://i3.ytimg.com/vi/jTD_JdU6otI/hqdefault.jpg",
      "type": "vídeo"
    },
    {
      "@type": "Legislation",
      "name": "INSTRUÇÃO NORMATIVA Nº 215, 01/09/2025",
      "url": "https://www.anac.gov.br/assuntos/legislacao/legislacao-1/instrucoes-normativas/2025/instrucao-normativa-215",
      "datePublished": "2025-09-01T00:00:00.000Z",
      "description": "Altera a Instrução Normativa nº 117, de 6 de setembro de 2017",
      "type": "legislação"
    },
    {
      "@type": "VideoObject",
      "name": "Webinário Engenharia de Aeroportos 2025",
      "url": "https://www.youtube.com/watch?v=qwyqefU-Za8",
      "datePublished": "2025-08-30T07:56:49.000Z",
      "description": "O evento objetiva o compartilhamento de temas relevantes no contexto da Engenharia de Aeroportos, levando a todos os participantes conhecimento a respeito das mudanças regulatórias que estarão em breve em vigor, seus impactos e como se adequar à nova realidade. Busca-se, também, que cada palestrante seja capaz de trazer assuntos relevantes, proporcionando melhoria na cultura de segurança operacional a partir da divulgação das melhores técnicas de Engenharia de Aeroportos existentes. \n\nA meta é difundir o conhecimento, aumentando a conscientização dos regulados.\n\nProgramação e mais informações no site do evento https://www.gov.br/anac/pt-br/centrais-de-conteudo/eventos/eventos-da-anac/eventos/webinario-de-engenharia-de-aeroportos-2025\n\nDúvidas e perguntas (Slido) - https://app.sli.do/event/gALPhZRPaRjKAD2H9cmW3Y\n\nAPRESENTAÇÕES: Todas as apresentações: https://www.gov.br/anac/pt-br/centrais-de-conteudo/eventos/eventos-da-anac/eventos/arquivos/engenheira-de-aeroportos-apr-1.zip",
      "image": "https://i2.ytimg.com/vi/qwyqefU-Za8/hqdefault.jpg",
      "type": "vídeo"
    },
    {
      "@type": "VideoObject",
      "name": "Webinário Engenharia de Aeroportos 2025",
      "url": "https://www.youtube.com/watch?v=ijUF7KGaE1Q",
      "datePublished": "2025-08-29T07:48:04.000Z",
      "description": "O evento objetiva o compartilhamento de temas relevantes no contexto da Engenharia de Aeroportos, levando a todos os participantes conhecimento a respeito das mudanças regulatórias que estarão em breve em vigor, seus impactos e como se adequar à nova realidade. Busca-se, também, que cada palestrante seja capaz de trazer assuntos relevantes, proporcionando melhoria na cultura de segurança operacional a partir da divulgação das melhores técnicas de Engenharia de Aeroportos existentes. \n\nA meta é difundir o conhecimento, aumentando a conscientização dos regulados.\n\nProgramação e mais informações no site do evento https://www.gov.br/anac/pt-br/centrais-de-conteudo/eventos/eventos-da-anac/eventos/webinario-de-engenharia-de-aeroportos-2025\n\nDúvidas e perguntas (Slido) - https://app.sli.do/event/aQHew5VUdemc28vnaP2W7H",
      "image": "https://i2.ytimg.com/vi/ijUF7KGaE1Q/hqdefault.jpg",
      "type": "vídeo"
    },
    {
      "@type": "Legislation",
      "name": "RBAC 25 EMD 150",
      "url": "https://www.anac.gov.br/assuntos/legislacao/legislacao-1/rbha-e-rbac/rbac/rbac-25",
      "datePublished": "2025-08-28T17:55:00.000Z",
      "description": "Requisitos de Aeronavegabilidade: Aviões Categoria Transporte",
      "type": "legislação"
    },
    {
      "@type": "Legislation",
      "name": "DECISÃO Nº 722, 28/08/2025",
      "url": "https://www.anac.gov.br/assuntos/legislacao/legislacao-1/decisoes/2025/decisao-722",
      "datePublished": "2025-08-28T00:00:00.000Z",
      "description": "Defere pedido de isenção temporária e parcial de cumprimento do requisito de que trata o parágrafo 135.151(a)(1) do RBAC nº 135, em favor da RICO TÁXI AÉREO LTDA.",
      "type": "legislação"
    },
    {
      "@type": "VideoObject",
      "name": "Webinário Engenharia de Aeroportos 2025",
      "url": "https://www.youtube.com/watch?v=zoj9US-rtXA",
      "datePublished": "2025-08-27T19:49:54.000Z",
      "description": "O evento objetiva o compartilhamento de temas relevantes no contexto da Engenharia de Aeroportos, levando a todos os participantes conhecimento a respeito das mudanças regulatórias que estarão em breve em vigor, seus impactos e como se adequar à nova realidade. Busca-se, também, que cada palestrante seja capaz de trazer assuntos relevantes, proporcionando melhoria na cultura de segurança operacional a partir da divulgação das melhores técnicas de Engenharia de Aeroportos existentes. \n\nA meta é difundir o conhecimento, aumentando a conscientização dos regulados.\n\nProgramação e mais informações no site do evento https://www.gov.br/anac/pt-br/centrais-de-conteudo/eventos/eventos-da-anac/eventos/webinario-de-engenharia-de-aeroportos-2025\n\nDúvidas e perguntas (Slido) - https://app.sli.do/event/8bV8Lo8SZu5sNDqwgBdrGz",
      "image": "https://i3.ytimg.com/vi/zoj9US-rtXA/hqdefault.jpg",
      "type": "vídeo"
    },
    {
      "@type": "VideoObject",
      "name": "11ª Reunião Deliberativa da Diretoria Colegiada (26/08/2025)",
      "url": "https://www.youtube.com/watch?v=gx-VCn_gx98",
      "datePublished": "2025-08-26T18:29:10.000Z",
      "description": "Processo 00058.030675/2025-84",
      "image": "https://i4.ytimg.com/vi/gx-VCn_gx98/hqdefault.jpg",
      "type": "vídeo"
    },
    {
      "@type": "VideoObject",
      "name": "Webinário BHEST - PROCESSO DECISÓRIO NA AVIAÇÃO DE ASAS ROTATIVAS",
      "url": "https://www.youtube.com/watch?v=dTihSc1E3_M",
      "datePublished": "2025-08-22T09:15:57.000Z",
      "description": "Este evento faz parte da Ação Nacional de Aviação Civil, iniciativa instituída em 2011 pela ANAC com o objetivo de disseminar informações e conhecimentos sobre o transporte aéreo e de aumentar a proximidade da Agência com seus principais públicos, entre eles pilotos, profissionais, empresários, estudantes, pesquisadores ligados à aviação civil e demais interessados.\n\nO evento pretende atingir a maior quantidade de regulados possível e apresentar diversos assuntos, conforme indicado na Programação, para fomentar a discussão, tratar e receber as críticas e sugestões e promover a melhoria da segurança operacional no Brasil.\n\nA iniciativa também é aderente ao Programa de Implementação do PSOE-ANAC, otimizando recursos e aperfeiçoando as ferramentas de disseminação da cultura de segurança operacional.\n\nPerguntas: https://app.sli.do/event/gCBZJAp3Q6wDmCPPk994pb",
      "image": "https://i1.ytimg.com/vi/dTihSc1E3_M/hqdefault.jpg",
      "type": "vídeo"
    }
  ]
}